[{"id":"3310082","title":"PSY 101 Lecture","start_at":"2026-11-25T14:00:00Z","end_at":"2026-11-25T14:50:00Z","workflow_state":"active","created_at":"2026-08-19T05:00:00Z","updated_at":"2026-08-19T05:00:00Z","all_day":false,"all_day_date":null,"comments":null,"series_uuid":"07f87583-04f4-4e5f-8c02-9b2a2288e862","rrule":"FREQ=WEEKLY;INTERVAL=1;BYDAY=MO,WE,FR;COUNT=48","blackout_date":false,"location_address":null,"location_name":"Sage Hall 101","type":"event","description":"","child_events_count":0,"all_context_codes":"course_51843","context_code":"course_51843","context_name":"Introduction to Psychology","context_color":null,"parent_event_id":null,"hidden":false,"child_events":[],"url":"https://canvas.northfield.example/api/v1/calendar_events/3310082","html_url":"https://canvas.northfield.example/calendar?event_id=3310082\u0026include_contexts=course_51843","duplicates":[],"important_dates":false,"series_head":false},{"id":"3310169","title":"Calculus II Lecture","start_at":"2026-11-25T16:00:00Z","end_at":"2026-11-25T16:50:00Z","workflow_state":"active","created_at":"2026-08-19T05:00:00Z","updated_at":"2026-08-19T05:00:00Z","all_day":false,"all_day_date":null,"comments":null,"series_uuid":"c4c8554b-85df-4661-a8e2-b91fdaf1dee7","rrule":"FREQ=WEEKLY;INTERVAL=1;BYDAY=MO,WE,FR;COUNT=48","blackout_date":false,"location_address":null,"location_name":"Sage Hall 210","type":"event","description":"","child_events_count":0,"all_context_codes":"course_51842","context_code":"course_51842","context_name":"Calculus II","context_color":null,"parent_event_id":null,"hidden":false,"child_events":[],"url":"https://canvas.northfield.example/api/v1/calendar_events/3310169","html_url":"https://canvas.northfield.example/calendar?event_id=3310169\u0026include_contexts=course_51842","duplicates":[],"important_dates":false,"series_head":false},{"id":"3310083","title":"PSY 101 Lecture","start_at":"2026-11-27T14:00:00Z","end_at":"2026-11-27T14:50:00Z","workflow_state":"active","created_at":"2026-08-19T05:00:00Z","updated_at":"2026-08-19T05:00:00Z","all_day":false,"all_day_date":null,"comments":null,"series_uuid":"07f87583-04f4-4e5f-8c02-9b2a2288e862","rrule":"FREQ=WEEKLY;INTERVAL=1;BYDAY=MO,WE,FR;COUNT=48","blackout_date":false,"location_address":null,"location_name":"Sage Hall 101","type":"event","description":"","child_events_count":0,"all_context_codes":"course_51843","context_code":"course_51843","context_name":"Introduction to Psychology","context_color":null,"parent_event_id":null,"hidden":false,"child_events":[],"url":"https://canvas.northfield.example/api/v1/calendar_events/3310083","html_url":"https://canvas.northfield.example/calendar?event_id=3310083\u0026include_contexts=course_51843","duplicates":[],"important_dates":false,"series_head":false},{"id":"3310172","title":"Calculus II Lecture","start_at":"2026-11-27T16:00:00Z","end_at":"2026-11-27T16:50:00Z","workflow_state":"active","created_at":"2026-08-19T05:00:00Z","updated_at":"2026-08-19T05:00:00Z","all_day":false,"all_day_date":null,"comments":null,"series_uuid":"c4c8554b-85df-4661-a8e2-b91fdaf1dee7","rrule":"FREQ=WEEKLY;INTERVAL=1;BYDAY=MO,WE,FR;COUNT=48","blackout_date":false,"location_address":null,"location_name":"Sage Hall 210","type":"event","description":"","child_events_count":0,"all_context_codes":"course_51842","context_code":"course_51842","context_name":"Calculus II","context_color":null,"parent_event_id":null,"hidden":false,"child_events":[],"url":"https://canvas.northfield.example/api/v1/calendar_events/3310172","html_url":"https://canvas.northfield.example/calendar?event_id=3310172\u0026include_contexts=course_51842","duplicates":[],"important_dates":false,"series_head":false}]