[{"id":"5510003","title":"Live lab session","start_at":"2026-10-01T17:00:00Z","end_at":"2026-10-01T18:00:00Z","workflow_state":"active","created_at":"2026-09-20T13:00:00Z","updated_at":"2026-09-20T13:00:00Z","all_day":false,"all_day_date":null,"comments":null,"series_uuid":null,"rrule":null,"blackout_date":false,"location_address":null,"location_name":"Online","type":"event","description":"\u003cp\u003eJoin from the Live Sessions page in the course.\u003c/p\u003e","child_events_count":0,"all_context_codes":"course_90412","context_code":"course_90412","context_name":"Chemistry Honors","context_color":null,"parent_event_id":null,"hidden":false,"child_events":[],"url":"https://northgate.instructure.example/api/v1/calendar_events/5510003","html_url":"https://northgate.instructure.example/calendar?event_id=5510003\u0026include_contexts=course_90412","duplicates":[],"important_dates":false},{"id":"5510000","title":"Quarter 1 ends","start_at":"2026-10-16T04:00:00Z","end_at":"2026-10-16T04:00:00Z","workflow_state":"active","created_at":"2026-08-01T13:00:00Z","updated_at":"2026-08-01T13:00:00Z","all_day":true,"all_day_date":"2026-10-16","comments":null,"series_uuid":null,"rrule":null,"blackout_date":false,"location_address":null,"location_name":null,"type":"event","description":"","child_events_count":0,"all_context_codes":"course_90411","context_code":"course_90411","context_name":"Algebra II","context_color":null,"parent_event_id":null,"hidden":false,"child_events":[],"url":"https://northgate.instructure.example/api/v1/calendar_events/5510000","html_url":"https://northgate.instructure.example/calendar?event_id=5510000\u0026include_contexts=course_90411","duplicates":[],"important_dates":false}]