[{"id":"4410004","title":"Final review session","start_at":"2026-09-28T23:00:00Z","end_at":"2026-09-29T00:30:00Z","workflow_state":"active","created_at":"2026-09-21T17:00:00Z","updated_at":"2026-09-21T17:00:00Z","all_day":false,"all_day_date":null,"comments":null,"series_uuid":null,"rrule":null,"blackout_date":false,"location_address":null,"location_name":"Science 214","type":"event","description":"","child_events_count":0,"all_context_codes":"course_70312","context_code":"course_70312","context_name":"Introductory Chemistry","context_color":null,"parent_event_id":null,"hidden":false,"child_events":[],"url":"https://harborcity.instructure.example/api/v1/calendar_events/4410004","html_url":"https://harborcity.instructure.example/calendar?event_id=4410004\u0026include_contexts=course_70312","duplicates":[],"important_dates":false},{"id":"4410000","title":"ACCT 201 Final Exam","start_at":"2026-09-29T16:00:00Z","end_at":"2026-09-29T18:00:00Z","workflow_state":"active","created_at":"2026-08-05T17:00:00Z","updated_at":"2026-08-05T17:00:00Z","all_day":false,"all_day_date":null,"comments":null,"series_uuid":null,"rrule":null,"blackout_date":false,"location_address":null,"location_name":"Business 140","type":"event","description":"","child_events_count":0,"all_context_codes":"course_70311","context_code":"course_70311","context_name":"Principles of Accounting I","context_color":null,"parent_event_id":null,"hidden":false,"child_events":[],"url":"https://harborcity.instructure.example/api/v1/calendar_events/4410000","html_url":"https://harborcity.instructure.example/calendar?event_id=4410000\u0026include_contexts=course_70311","duplicates":[],"important_dates":true},{"id":"4410002","title":"CHEM 110 Final Exam","start_at":"2026-09-29T17:30:00Z","end_at":"2026-09-29T19:30:00Z","workflow_state":"active","created_at":"2026-08-05T17:00:00Z","updated_at":"2026-08-05T17:00:00Z","all_day":false,"all_day_date":null,"comments":null,"series_uuid":null,"rrule":null,"blackout_date":false,"location_address":null,"location_name":"Science 301","type":"event","description":"\u003cp\u003eRoom changed from Science 214 to Science 301.\u003c/p\u003e","child_events_count":0,"all_context_codes":"course_70312","context_code":"course_70312","context_name":"Introductory Chemistry","context_color":null,"parent_event_id":null,"hidden":false,"child_events":[],"url":"https://harborcity.instructure.example/api/v1/calendar_events/4410002","html_url":"https://harborcity.instructure.example/calendar?event_id=4410002\u0026include_contexts=course_70312","duplicates":[],"important_dates":true},{"id":"4410008","title":"Office hours (final project)","start_at":"2026-09-29T22:00:00Z","end_at":"2026-09-29T23:00:00Z","workflow_state":"active","created_at":"2026-09-22T17:00:00Z","updated_at":"2026-09-22T17:00:00Z","all_day":false,"all_day_date":null,"comments":null,"series_uuid":null,"rrule":null,"blackout_date":false,"location_address":null,"location_name":"Library 2B","type":"event","description":"","child_events_count":0,"all_context_codes":"course_70313","context_code":"course_70313","context_name":"Elementary Statistics","context_color":null,"parent_event_id":null,"hidden":false,"child_events":[],"url":"https://harborcity.instructure.example/api/v1/calendar_events/4410008","html_url":"https://harborcity.instructure.example/calendar?event_id=4410008\u0026include_contexts=course_70313","duplicates":[],"important_dates":false},{"id":"4410007","title":"STAT 150 Final Exam","start_at":"2026-09-30T20:00:00Z","end_at":"2026-09-30T22:00:00Z","workflow_state":"active","created_at":"2026-08-05T17:00:00Z","updated_at":"2026-08-05T17:00:00Z","all_day":false,"all_day_date":null,"comments":null,"series_uuid":null,"rrule":null,"blackout_date":false,"location_address":null,"location_name":"Online (proctored)","type":"event","description":"","child_events_count":0,"all_context_codes":"course_70313","context_code":"course_70313","context_name":"Elementary Statistics","context_color":null,"parent_event_id":null,"hidden":false,"child_events":[],"url":"https://harborcity.instructure.example/api/v1/calendar_events/4410007","html_url":"https://harborcity.instructure.example/calendar?event_id=4410007\u0026include_contexts=course_70313","duplicates":[],"important_dates":true},{"id":"4410010","title":"Final Persuasive Speeches","start_at":"2026-10-01T16:00:00Z","end_at":"2026-10-01T18:30:00Z","workflow_state":"active","created_at":"2026-08-05T17:00:00Z","updated_at":"2026-08-05T17:00:00Z","all_day":false,"all_day_date":null,"comments":null,"series_uuid":null,"rrule":null,"blackout_date":false,"location_address":null,"location_name":"Fine Arts 12","type":"event","description":"","child_events_count":0,"all_context_codes":"course_70314","context_code":"course_70314","context_name":"Public Speaking","context_color":null,"parent_event_id":null,"hidden":false,"child_events":[],"url":"https://harborcity.instructure.example/api/v1/calendar_events/4410010","html_url":"https://harborcity.instructure.example/calendar?event_id=4410010\u0026include_contexts=course_70314","duplicates":[],"important_dates":true},{"id":"4410011","title":"Session 1 grades due","start_at":"2026-10-06T07:00:00Z","end_at":"2026-10-06T07:00:00Z","workflow_state":"active","created_at":"2026-08-05T17:00:00Z","updated_at":"2026-08-05T17:00:00Z","all_day":true,"all_day_date":"2026-10-06","comments":null,"series_uuid":null,"rrule":null,"blackout_date":false,"location_address":null,"location_name":null,"type":"event","description":"","child_events_count":0,"all_context_codes":"course_70311","context_code":"course_70311","context_name":"Principles of Accounting I","context_color":null,"parent_event_id":null,"hidden":false,"child_events":[],"url":"https://harborcity.instructure.example/api/v1/calendar_events/4410011","html_url":"https://harborcity.instructure.example/calendar?event_id=4410011\u0026include_contexts=course_70311","duplicates":[],"important_dates":false}]